{
  "chargeCategory": "Slow",
  "chargeDamage": 120.0,
  "coop": false,
  "damageType": "NoDamage",
  "description": {
    "ar": "يمكن اكتساب حماس غير محدود <sprite name=\"icon_blackSoul\"> لمدة 5 ثوانٍ.",
    "de": "Erhalte 5 Sekunden lang unendlich Eifer <sprite name=\"icon_blackSoul\">.",
    "en": "Gain unlimited Fervour <sprite name=\"icon_blackSoul\"> for 5 seconds.",
    "es": "Obtén fervor ilimitado <sprite name=\"icon_blackSoul\"> durante 5 segundos.",
    "fr": "Octroie ferveur <sprite name=\"icon_blackSoul\"> illimitée pendant 5 secondes.",
    "fr-CA": "Octroie ferveur <sprite name=\"icon_blackSoul\"> illimitée pendant 5 secondes.",
    "it": "Conferisce Fervore infinito <sprite name=\"icon_blackSoul\"> per 5 secondi.",
    "ja": "5秒間、信力 <sprite name=\"icon_blackSoul\"> が無限になる",
    "ko": "5초 동안 무제한 열정 <sprite name=\"icon_blackSoul\">을 얻습니다.",
    "nl": "Krijg 5 seconden lang onbeperkte furie <sprite name=\"icon_blackSoul\">.",
    "pt-BR": "Ganha Fervor <sprite name=\"icon_blackSoul\"> ilimitado por 5 segundos.",
    "ru": "Усердие <sprite name=\"icon_blackSoul\"> не истощается в течение 5 сек.",
    "tr": "5 saniyeliğine sınırsız Şevk <sprite name=\"icon_blackSoul\"> kazanırsın.",
    "zh-CN": "获得无限热诚 <sprite name=\"icon_blackSoul\">，持续 5 秒。",
    "zh-TW": "獲得無限熱誠 <sprite name=\"icon_blackSoul\">，持續 5 秒。"
  },
  "descriptionPlain": {
    "ar": "يمكن اكتساب حماس غير محدود لمدة 5 ثوانٍ.",
    "de": "Erhalte 5 Sekunden lang unendlich Eifer.",
    "en": "Gain unlimited Fervour for 5 seconds.",
    "es": "Obtén fervor ilimitado durante 5 segundos.",
    "fr": "Octroie ferveur illimitée pendant 5 secondes.",
    "fr-CA": "Octroie ferveur illimitée pendant 5 secondes.",
    "it": "Conferisce Fervore infinito per 5 secondi.",
    "ja": "5秒間、信力 が無限になる",
    "ko": "5초 동안 무제한 열정 을 얻습니다.",
    "nl": "Krijg 5 seconden lang onbeperkte furie.",
    "pt-BR": "Ganha Fervor ilimitado por 5 segundos.",
    "ru": "Усердие не истощается в течение 5 сек.",
    "tr": "5 saniyeliğine sınırsız Şevk kazanırsın.",
    "zh-CN": "获得无限热诚 ，持续 5 秒。",
    "zh-TW": "獲得無限熱誠 ，持續 5 秒。"
  },
  "dlc": false,
  "icon": "icons/relics/UnlimitedFervour.png",
  "id": "UnlimitedFervour",
  "interactionType": "Charging",
  "lore": {
    "ar": "ليس صلبًا ولا سائلًا ولا دخانًا...",
    "de": "Nicht fest, nicht flüssig, nicht gasförmig …",
    "en": "Not solid, nor liquid, nor smoke...",
    "es": "Ni sólido, ni líquido, ni humo...",
    "fr": "Ni solide, ni liquide, ni gazeux...",
    "fr-CA": "Ni solide, ni liquide, ni gazeux...",
    "it": "Né solido, né liquido, né gassoso...",
    "ja": "固体でも、液体でも、気体でもない…",
    "ko": "고체도 아니요, 액체도 아니요, 연기도 아닐지니...",
    "nl": "Niet vast, noch vloeibaar, noch rook...",
    "pt-BR": "Não é sólido, nem líquido, nem gasoso...",
    "ru": "Не твёрдый, не жидкий, не эфемерный.",
    "tr": "Ne katı ne sıvı ne de duman...",
    "zh-CN": "非固、非液、非气……",
    "zh-TW": "非固、非液、非氣……"
  },
  "majorDlc": false,
  "name": {
    "ar": "رحيق التيجان",
    "de": "Nektar der Kronen",
    "en": "Nectar of the Crowns",
    "es": "Néctar de las Coronas",
    "fr": "Nectar des Couronnes",
    "fr-CA": "Nectar des Couronnes",
    "it": "Nettare delle Corone",
    "ja": "王冠のネクター",
    "ko": "왕관의 넥타르",
    "nl": "Nectar van de kronen",
    "pt-BR": "Néctar das Coroas",
    "ru": "Нектар коронованных",
    "tr": "Taç Nektarı",
    "zh-CN": "圣冠琼浆",
    "zh-TW": "聖冠瓊漿"
  },
  "namePlain": {
    "ar": "رحيق التيجان",
    "de": "Nektar der Kronen",
    "en": "Nectar of the Crowns",
    "es": "Néctar de las Coronas",
    "fr": "Nectar des Couronnes",
    "fr-CA": "Nectar des Couronnes",
    "it": "Nettare delle Corone",
    "ja": "王冠のネクター",
    "ko": "왕관의 넥타르",
    "nl": "Nectar van de kronen",
    "pt-BR": "Néctar das Coroas",
    "ru": "Нектар коронованных",
    "tr": "Taç Nektarı",
    "zh-CN": "圣冠琼浆",
    "zh-TW": "聖冠瓊漿"
  },
  "requiresCult": false,
  "subType": "Any",
  "thumb": "icons/relics/64/UnlimitedFervour.png",
  "unlockedBy": "Building_LightningRod",
  "weight": 1.0
}
