{
  "chargeCategory": "Slow",
  "chargeDamage": 80.0,
  "coop": false,
  "damageType": "NoDamage",
  "description": {
    "ar": "حماية من القذائف لمدة 10 ثوانٍ.",
    "de": "10 Sekunden lang immun gegen Projektile.",
    "en": "Immune to projectiles for 10 seconds.",
    "es": "Inmune a los proyectiles durante 10 segundos.",
    "fr": "Immunise contre les projectiles pendant 10 secondes.",
    "fr-CA": "Immunise contre les projectiles pendant 10 secondes.",
    "it": "Immunità ai proiettili per 10 secondi.",
    "ja": "遠距離攻撃を10秒間無効化する",
    "ko": "10초 동안 탄환에 면역이 됩니다.",
    "nl": "Immuun voor projectielen gedurende 10 seconden.",
    "pt-BR": "Imune a projéteis por 10 segundos.",
    "ru": "Вы не получаете урона от снарядов в течение 10 сек.",
    "tr": "10 saniye boyunca menzilli saldırılardan hasar almazsın.",
    "zh-CN": "对投射物免疫 10 秒。",
    "zh-TW": "對投射物免疫 10 秒。"
  },
  "descriptionPlain": {
    "ar": "حماية من القذائف لمدة 10 ثوانٍ.",
    "de": "10 Sekunden lang immun gegen Projektile.",
    "en": "Immune to projectiles for 10 seconds.",
    "es": "Inmune a los proyectiles durante 10 segundos.",
    "fr": "Immunise contre les projectiles pendant 10 secondes.",
    "fr-CA": "Immunise contre les projectiles pendant 10 secondes.",
    "it": "Immunità ai proiettili per 10 secondi.",
    "ja": "遠距離攻撃を10秒間無効化する",
    "ko": "10초 동안 탄환에 면역이 됩니다.",
    "nl": "Immuun voor projectielen gedurende 10 seconden.",
    "pt-BR": "Imune a projéteis por 10 segundos.",
    "ru": "Вы не получаете урона от снарядов в течение 10 сек.",
    "tr": "10 saniye boyunca menzilli saldırılardan hasar almazsın.",
    "zh-CN": "对投射物免疫 10 秒。",
    "zh-TW": "對投射物免疫 10 秒。"
  },
  "dlc": true,
  "icon": "icons/relics/IceyCoat.png",
  "id": "IceyCoat",
  "interactionType": "Charging",
  "lore": {
    "ar": "سقطت من ظهر كائن زاحف عظيم.",
    "de": "Vom Rücken einer großen, kriechenden Kreatur abgestoßen.",
    "en": "Shed from the back of a great crawling creature.",
    "es": "Piel del lomo de una enorme criatura reptante.",
    "fr": "Tombée du dos d'une énorme créature rampante.",
    "fr-CA": "Tombée du dos d'une énorme créature rampante.",
    "it": "Staccatosi dal dorso di un'enorme creatura strisciante.",
    "ja": "地面を這う大いなる生物の背中から落ちたとされるもの",
    "ko": "기어다니는 거대 짐승에게서 떨어져 나온 것.",
    "nl": "Achtergebleven bij de vervelling van een monsterlijk wezen.",
    "pt-BR": "Tirado do corpo de uma grande criatura rastejante.",
    "ru": "Сброшена огромным ползучим существом.",
    "tr": "Yerde sürünen büyük bir yaratığın sırtından alınmış.",
    "zh-CN": "古代某种伟大爬行生物的空壳。",
    "zh-TW": "古代某種偉大爬行生物的空殼。"
  },
  "majorDlc": true,
  "name": {
    "ar": "قشرة التندرين",
    "de": "Hülle der Tundrane",
    "en": "Husk of the Tundrane",
    "es": "Muda de tundrane",
    "fr": "Enveloppe de la Toundrage",
    "fr-CA": "Enveloppe de la Toundrage",
    "it": "Guscio di Tundrane",
    "ja": "ツンドレインの抜け殻",
    "ko": "툰드레인의 저주",
    "nl": "Pantser van de vorstvlam",
    "pt-BR": "Casco de Tundrane",
    "ru": "Оболочка Тундрана",
    "tr": "Tundra Sineğinin Kabuğu",
    "zh-CN": "冻原之壳",
    "zh-TW": "凍原之殼"
  },
  "namePlain": {
    "ar": "قشرة التندرين",
    "de": "Hülle der Tundrane",
    "en": "Husk of the Tundrane",
    "es": "Muda de tundrane",
    "fr": "Enveloppe de la Toundrage",
    "fr-CA": "Enveloppe de la Toundrage",
    "it": "Guscio di Tundrane",
    "ja": "ツンドレインの抜け殻",
    "ko": "툰드레인의 저주",
    "nl": "Pantser van de vorstvlam",
    "pt-BR": "Casco de Tundrane",
    "ru": "Оболочка Тундрана",
    "tr": "Tundra Sineğinin Kabuğu",
    "zh-CN": "冻原之壳",
    "zh-TW": "凍原之殼"
  },
  "requiresCult": false,
  "subType": "Any",
  "thumb": "icons/relics/64/IceyCoat.png",
  "unlockedBy": "Relics_Ice",
  "weight": 1.0
}
