{
  "chargeCategory": "Average",
  "chargeDamage": 60.0,
  "coop": false,
  "damageType": "DealsDamage",
  "description": {
    "ar": "يمكن إطلاق ثلاث قذائف لكل حذاء مجهَّز ببطاقة تارو. إن لم يكن لديك بطاقات تارو يمكن إطلاق قذيفتين.",
    "de": "Feuere drei Projektile für jede ausgerüstete Tarotkarte ab. Wenn du keine Tarotkarten besitzt, feuerst du zwei Projektile ab.",
    "en": "Fire three projectiles for each equipped Tarot Card. If you have no Tarot Cards, fire two projectiles.",
    "es": "Dispara tres proyectiles por cada carta del tarot equipada. Si no tienes ninguna, dispara dos proyectiles.",
    "fr": "Tire trois projectiles pour chaque carte de tarot équipée. Si vous n'en portez aucune, tire deux projectiles.",
    "fr-CA": "Tire trois projectiles pour chaque carte de tarot équipée. Si vous n'en portez aucune, tire deux projectiles.",
    "it": "Lancia tre proiettili per ogni tarocco attivo. Se non ne hai, lancia due proiettili.",
    "ja": "装備中のタロットカードの枚数分、3つの弾を射出する。タロットがない場合、2つの弾を射出する",
    "ko": "장비한 타로 카드 한 장당 투사체를 3개 발사합니다. 타로 카드가 없을 경우, 2개를 발사합니다.",
    "nl": "Vuur drie projectielen af voor elke tarotkaart die je hebt. Als je geen tarotkaarten hebt, dan vuur je twee projectielen af.",
    "pt-BR": "Dispare três projéteis para cada Carta de Tarô equipada. Se não tiver nenhuma Carta de Tarô, dispare dois projéteis.",
    "ru": "Вы выпускаете по три снаряда за каждую имеющуюся карту Таро или два снаряда, если у вас нет карт Таро.",
    "tr": "Sahip olduğun her Tarot Kartı için üç menzilli saldırı yaparsın. Hiç Tarot Kartı'n yoksa iki menzilli saldırı yaparsın.",
    "zh-CN": "每装备一张塔罗牌，就射出三个投射物。没有塔罗牌时，射出二个投射物。",
    "zh-TW": "每裝備一張塔羅牌，就射出三個投射物。沒有塔羅牌時，射出二個投射物。"
  },
  "descriptionPlain": {
    "ar": "يمكن إطلاق ثلاث قذائف لكل حذاء مجهَّز ببطاقة تارو. إن لم يكن لديك بطاقات تارو يمكن إطلاق قذيفتين.",
    "de": "Feuere drei Projektile für jede ausgerüstete Tarotkarte ab. Wenn du keine Tarotkarten besitzt, feuerst du zwei Projektile ab.",
    "en": "Fire three projectiles for each equipped Tarot Card. If you have no Tarot Cards, fire two projectiles.",
    "es": "Dispara tres proyectiles por cada carta del tarot equipada. Si no tienes ninguna, dispara dos proyectiles.",
    "fr": "Tire trois projectiles pour chaque carte de tarot équipée. Si vous n'en portez aucune, tire deux projectiles.",
    "fr-CA": "Tire trois projectiles pour chaque carte de tarot équipée. Si vous n'en portez aucune, tire deux projectiles.",
    "it": "Lancia tre proiettili per ogni tarocco attivo. Se non ne hai, lancia due proiettili.",
    "ja": "装備中のタロットカードの枚数分、3つの弾を射出する。タロットがない場合、2つの弾を射出する",
    "ko": "장비한 타로 카드 한 장당 투사체를 3개 발사합니다. 타로 카드가 없을 경우, 2개를 발사합니다.",
    "nl": "Vuur drie projectielen af voor elke tarotkaart die je hebt. Als je geen tarotkaarten hebt, dan vuur je twee projectielen af.",
    "pt-BR": "Dispare três projéteis para cada Carta de Tarô equipada. Se não tiver nenhuma Carta de Tarô, dispare dois projéteis.",
    "ru": "Вы выпускаете по три снаряда за каждую имеющуюся карту Таро или два снаряда, если у вас нет карт Таро.",
    "tr": "Sahip olduğun her Tarot Kartı için üç menzilli saldırı yaparsın. Hiç Tarot Kartı'n yoksa iki menzilli saldırı yaparsın.",
    "zh-CN": "每装备一张塔罗牌，就射出三个投射物。没有塔罗牌时，射出二个投射物。",
    "zh-TW": "每裝備一張塔羅牌，就射出三個投射物。沒有塔羅牌時，射出二個投射物。"
  },
  "dlc": false,
  "icon": "icons/relics/ProjectileRing.png",
  "id": "ProjectileRing",
  "interactionType": "Charging",
  "lore": {
    "ar": "هل يعرف حتى أنه مفقود؟",
    "de": "Weiß er überhaupt, dass er weg ist?",
    "en": "Does he even know that it's missing?",
    "es": "¿Sabe siquiera que ha desaparecido?",
    "fr": "Est-ce qu'il a remarqué qu'il l'avait perdue ?",
    "fr-CA": "Est-ce qu'il a remarqué qu'il l'avait perdue?",
    "it": "Si è accorto che gli manca?",
    "ja": "靴がないことに、彼は気が付いているのだろうか？",
    "ko": "자기가 잃어버린 게 뭔지나 알까?",
    "nl": "Weet hij überhaupt dat hij die kwijt is?",
    "pt-BR": "Ele nem mesmo percebeu que está faltando um?",
    "ru": "Знает ли о потере он сам?",
    "tr": "Bunun kaybolduğunun farkında mı acaba?",
    "zh-CN": "他知道鞋子不见了吗？",
    "zh-TW": "他知道鞋子不見了嗎？"
  },
  "majorDlc": false,
  "name": {
    "ar": "حذاء كلاونيك",
    "de": "Claunecks Schuh",
    "en": "Clauneck's Shoe",
    "es": "Zapato de Clauneck",
    "fr": "Chaussure de Clauneck",
    "fr-CA": "Chaussure de Clauneck",
    "it": "Calzatura di Clauneck",
    "ja": "クラウネックの靴",
    "ko": "클라우넥의 신발",
    "nl": "Claunecks schoen",
    "pt-BR": "Sapato de Clauneck",
    "ru": "Тапочек Клонека",
    "tr": "Clauneck'in Ayakkabısı",
    "zh-CN": "克劳内克之鞋",
    "zh-TW": "克勞涅克之鞋"
  },
  "namePlain": {
    "ar": "حذاء كلاونيك",
    "de": "Claunecks Schuh",
    "en": "Clauneck's Shoe",
    "es": "Zapato de Clauneck",
    "fr": "Chaussure de Clauneck",
    "fr-CA": "Chaussure de Clauneck",
    "it": "Calzatura di Clauneck",
    "ja": "クラウネックの靴",
    "ko": "클라우넥의 신발",
    "nl": "Claunecks schoen",
    "pt-BR": "Sapato de Clauneck",
    "ru": "Тапочек Клонека",
    "tr": "Clauneck'in Ayakkabısı",
    "zh-CN": "克劳内克之鞋",
    "zh-TW": "克勞涅克之鞋"
  },
  "requiresCult": false,
  "subType": "Any",
  "thumb": "icons/relics/64/ProjectileRing.png",
  "unlockedBy": "Building_LightningRod",
  "weight": 1.0
}
