{
  "chargeCategory": "Average",
  "chargeDamage": 60.0,
  "coop": false,
  "damageType": "DealsDamage",
  "description": {
    "ar": "يمكن إلحاق الضرر بجميع الأعداء وفقًا لعدد بطاقات التارو التي لديك.",
    "de": "Füge allen Gegnern Schaden entsprechend der Menge deiner Tarotkarten zu.",
    "en": "Deal damage to all enemies based on the amount of Tarot Cards you hold.",
    "es": "Inflige daño a todos los enemigos en función del número de cartas del tarot que tengas.",
    "fr": "Inflige des dégâts à tous les ennemis selon le nombre de cartes de tarot que vous avez.",
    "fr-CA": "Inflige des dégâts à tous les ennemis selon le nombre de cartes de tarot que vous avez.",
    "it": "Infligge danni a tutti i nemici in base al numero di tarocchi attivi.",
    "ja": "所持しているタロットカードの枚数に応じたダメージを敵全体に与える",
    "ko": "보유한 타로 카드의 수에 비례한 피해를 모든 적에게 가합니다.",
    "nl": "Breng schade toe aan alle vijanden op basis van het aantal tarotkaarten dat je bij je hebt.",
    "pt-BR": "Cause dano a todos os inimigos com base na quantidade de Cartas de Tarô que você carrega.",
    "ru": "Вы наносите врагам урон, зависящий от количества имеющихся карт Таро.",
    "tr": "Düşmanlara elindeki Tarot Kartı sayısına bağlı olarak hasar verir.",
    "zh-CN": "依照持有的塔罗牌数量，对所有敌人造成伤害。",
    "zh-TW": "依照持有的塔羅牌數量，對所有敵人造成傷害。"
  },
  "descriptionPlain": {
    "ar": "يمكن إلحاق الضرر بجميع الأعداء وفقًا لعدد بطاقات التارو التي لديك.",
    "de": "Füge allen Gegnern Schaden entsprechend der Menge deiner Tarotkarten zu.",
    "en": "Deal damage to all enemies based on the amount of Tarot Cards you hold.",
    "es": "Inflige daño a todos los enemigos en función del número de cartas del tarot que tengas.",
    "fr": "Inflige des dégâts à tous les ennemis selon le nombre de cartes de tarot que vous avez.",
    "fr-CA": "Inflige des dégâts à tous les ennemis selon le nombre de cartes de tarot que vous avez.",
    "it": "Infligge danni a tutti i nemici in base al numero di tarocchi attivi.",
    "ja": "所持しているタロットカードの枚数に応じたダメージを敵全体に与える",
    "ko": "보유한 타로 카드의 수에 비례한 피해를 모든 적에게 가합니다.",
    "nl": "Breng schade toe aan alle vijanden op basis van het aantal tarotkaarten dat je bij je hebt.",
    "pt-BR": "Cause dano a todos os inimigos com base na quantidade de Cartas de Tarô que você carrega.",
    "ru": "Вы наносите врагам урон, зависящий от количества имеющихся карт Таро.",
    "tr": "Düşmanlara elindeki Tarot Kartı sayısına bağlı olarak hasar verir.",
    "zh-CN": "依照持有的塔罗牌数量，对所有敌人造成伤害。",
    "zh-TW": "依照持有的塔羅牌數量，對所有敵人造成傷害。"
  },
  "dlc": false,
  "icon": "icons/relics/DestroyTarotDealDamge.png",
  "id": "DestroyTarotDealDamge",
  "interactionType": "Charging",
  "lore": {
    "ar": "ريش الوفرة والحظ.",
    "de": "Gefiedert und vom Zufall bestimmt.",
    "en": "Feathered and fortuitous.",
    "es": "Emplumado y fortuito.",
    "fr": "Porte-plume, et porte chance.",
    "fr-CA": "Porte-plume et porte-bonheur.",
    "it": "Piumati e fortunati.",
    "ja": "この羽毛は幸運をもたらす",
    "ko": "깃털 투성이의 행운이다.",
    "nl": "Gevederd en fortuinlijk.",
    "pt-BR": "Emplumado e fortuito.",
    "ru": "Удача в пучке волос.",
    "tr": "Tüylü ve tesadüfi.",
    "zh-CN": "带有羽毛及机运。",
    "zh-TW": "帶有羽毛及機運。"
  },
  "majorDlc": false,
  "name": {
    "ar": "خُصلة كلاونيك",
    "de": "Claunecks Haar",
    "en": "Clauneck's Hair",
    "es": "Pelo de Clauneck",
    "fr": "Cheveux de Clauneck",
    "fr-CA": "Cheveux de Clauneck",
    "it": "Capelli di Clauneck",
    "ja": "クラウネックの羽毛",
    "ko": "클라우넥의 머리카락",
    "nl": "Claunecks haar",
    "pt-BR": "Cabelo de Clauneck",
    "ru": "Прядь Клонека",
    "tr": "Clauneck'in Saçı",
    "zh-CN": "克劳内克之毛发",
    "zh-TW": "克勞涅克之毛髮"
  },
  "namePlain": {
    "ar": "خُصلة كلاونيك",
    "de": "Claunecks Haar",
    "en": "Clauneck's Hair",
    "es": "Pelo de Clauneck",
    "fr": "Cheveux de Clauneck",
    "fr-CA": "Cheveux de Clauneck",
    "it": "Capelli di Clauneck",
    "ja": "クラウネックの羽毛",
    "ko": "클라우넥의 머리카락",
    "nl": "Claunecks haar",
    "pt-BR": "Cabelo de Clauneck",
    "ru": "Прядь Клонека",
    "tr": "Clauneck'in Saçı",
    "zh-CN": "克劳内克之毛发",
    "zh-TW": "克勞涅克之毛髮"
  },
  "requiresCult": false,
  "subType": "Any",
  "thumb": "icons/relics/64/DestroyTarotDealDamge.png",
  "unlockedBy": "Relic_Pack_Default",
  "weight": 1.0
}
