{
  "chargeCategory": "Fast",
  "chargeDamage": 30.0,
  "coop": false,
  "damageType": "NoDamage",
  "description": {
    "ar": "يمكن تقليل حجم الحَمَل.",
    "de": "Werde kleiner.",
    "en": "Decrease in size.",
    "es": "Reduce el tamaño.",
    "fr": "Diminue votre taille.",
    "fr-CA": "Diminue votre taille.",
    "it": "Ti riduce di statura.",
    "ja": "体が小さくなる",
    "ko": "크기가 줄어듭니다.",
    "nl": "Word kleiner.",
    "pt-BR": "Diminua de tamanho.",
    "ru": "Вы уменьшаетесь в размерах.",
    "tr": "Boyutun küçülür.",
    "zh-CN": "体型变小。",
    "zh-TW": "體型變小。"
  },
  "descriptionPlain": {
    "ar": "يمكن تقليل حجم الحَمَل.",
    "de": "Werde kleiner.",
    "en": "Decrease in size.",
    "es": "Reduce el tamaño.",
    "fr": "Diminue votre taille.",
    "fr-CA": "Diminue votre taille.",
    "it": "Ti riduce di statura.",
    "ja": "体が小さくなる",
    "ko": "크기가 줄어듭니다.",
    "nl": "Word kleiner.",
    "pt-BR": "Diminua de tamanho.",
    "ru": "Вы уменьшаетесь в размерах.",
    "tr": "Boyutun küçülür.",
    "zh-CN": "体型变小。",
    "zh-TW": "體型變小。"
  },
  "dlc": false,
  "icon": "icons/relics/Shrink.png",
  "id": "Shrink",
  "interactionType": "Fragile",
  "lore": {
    "ar": "شونرو، عدو معروف.",
    "de": "Shunrue, berühmter Gegner.",
    "en": "Shunrue, famed foe.",
    "es": "Shunrue, rival legendario.",
    "fr": "Shunrue, mon ennemi juré.",
    "fr-CA": "Shunrue, mon ennemi juré.",
    "it": "Shunrue, famigerato nemico.",
    "ja": "名うての敵、その名もシュンルー",
    "ko": "슌뤼, 유명한 적이다.",
    "nl": "Shunrue, beroemde vijand.",
    "pt-BR": "Shunrue, antagonista notável.",
    "ru": "Шунру, заклятый враг.",
    "tr": "Meşhur düşman Shunrue.",
    "zh-CN": "襄茹，著名的强敌。",
    "zh-TW": "襄茹，著名的強敵。"
  },
  "majorDlc": false,
  "name": {
    "ar": "تميمة شونرو",
    "de": "Shunrues Talisman",
    "en": "Shunrue's Charm",
    "es": "Amuleto de Shunrue",
    "fr": "Charme de Shunrue",
    "fr-CA": "Charme de Shunrue",
    "it": "Portafortuna di Shunrue",
    "ja": "シュンルーの魔除け",
    "ko": "슌뤼의 부적",
    "nl": "Amulet van Shunrue",
    "pt-BR": "Amuleto de Shunrue",
    "ru": "Талисман Шунру",
    "tr": "Shunrue'nun Tılsımı",
    "zh-CN": "襄茹之护身符",
    "zh-TW": "襄茹之護身符"
  },
  "namePlain": {
    "ar": "تميمة شونرو",
    "de": "Shunrues Talisman",
    "en": "Shunrue's Charm",
    "es": "Amuleto de Shunrue",
    "fr": "Charme de Shunrue",
    "fr-CA": "Charme de Shunrue",
    "it": "Portafortuna di Shunrue",
    "ja": "シュンルーの魔除け",
    "ko": "슌뤼의 부적",
    "nl": "Amulet van Shunrue",
    "pt-BR": "Amuleto de Shunrue",
    "ru": "Талисман Шунру",
    "tr": "Shunrue'nun Tılsımı",
    "zh-CN": "襄茹之护身符",
    "zh-TW": "襄茹之護身符"
  },
  "requiresCult": false,
  "subType": "Any",
  "thumb": "icons/relics/64/Shrink.png",
  "unlockedBy": "Relic_Pack_Default",
  "weight": 1.0
}
