{
  "chargeCategory": "Fast",
  "chargeDamage": 30.0,
  "coop": false,
  "damageType": "NoDamage",
  "description": {
    "ar": "تبديل كل القلوب بقلوب مشتعلة.",
    "de": "Ersetze alle Herzen durch Geschmolzene Herzen.",
    "en": "Replace all hearts with Molten Hearts.",
    "es": "Reemplaza todos los corazones por corazones ígneos.",
    "fr": "Remplace tous les cœurs par des cœurs en fusion.",
    "fr-CA": "Remplace tous les cœurs par des cœurs en fusion.",
    "it": "Tutti i cuori vengono sostituiti da cuori ardenti.",
    "ja": "すべてのハートを炎の心臓に変換する",
    "ko": "모든 심장을 녹아내린 심장으로 교체합니다.",
    "nl": "Vervang alle harten door smeulende harten.",
    "pt-BR": "Substitui todos os corações por Corações Queimados.",
    "ru": "Все ваши сердца становятся раскалёнными.",
    "tr": "Tüm kalplerin Kor Kalp olur.",
    "zh-CN": "将所有心替换为熔心。",
    "zh-TW": "將所有心替換為熔心。"
  },
  "descriptionPlain": {
    "ar": "تبديل كل القلوب بقلوب مشتعلة.",
    "de": "Ersetze alle Herzen durch Geschmolzene Herzen.",
    "en": "Replace all hearts with Molten Hearts.",
    "es": "Reemplaza todos los corazones por corazones ígneos.",
    "fr": "Remplace tous les cœurs par des cœurs en fusion.",
    "fr-CA": "Remplace tous les cœurs par des cœurs en fusion.",
    "it": "Tutti i cuori vengono sostituiti da cuori ardenti.",
    "ja": "すべてのハートを炎の心臓に変換する",
    "ko": "모든 심장을 녹아내린 심장으로 교체합니다.",
    "nl": "Vervang alle harten door smeulende harten.",
    "pt-BR": "Substitui todos os corações por Corações Queimados.",
    "ru": "Все ваши сердца становятся раскалёнными.",
    "tr": "Tüm kalplerin Kor Kalp olur.",
    "zh-CN": "将所有心替换为熔心。",
    "zh-TW": "將所有心替換為熔心。"
  },
  "dlc": true,
  "icon": "icons/relics/FieryBlood.png",
  "id": "FieryBlood",
  "interactionType": "Fragile",
  "lore": {
    "ar": "يغطيه السناج لكنه لم يُحرق.",
    "de": "Mit Ruß bedeckt und doch unversengt.",
    "en": "Covered in soot and yet unburned.",
    "es": "Cubierto de hollín y, aun así, intacto.",
    "fr": "Outre la suie qui la recouvre, elle reste intacte.",
    "fr-CA": "Outre la suie qui la recouvre, elle demeure intacte.",
    "it": "Coperto di fuliggine, eppur intoccato dalle fiamme.",
    "ja": "煤に覆われているが、焼けてはいない",
    "ko": "그을음으로 덮였지만 아직 타지 않았다.",
    "nl": "Bedekt met roet maar niet verbrand.",
    "pt-BR": "A fuligem cobre seu corpo, mas não há queimaduras.",
    "ru": "Покрытый пеплом, но неопалённый.",
    "tr": "Kurumla kaplı olsa da yanmamış.",
    "zh-CN": "覆满煤灰，却还没燃烧起来。",
    "zh-TW": "覆滿煤灰，卻還沒燃燒起來。"
  },
  "majorDlc": true,
  "name": {
    "ar": "تمثال الموت حرقًا",
    "de": "Idol der Geopferten",
    "en": "Idol of the Immolated",
    "es": "Ídolo del sacrificado",
    "fr": "Idole des immolés",
    "fr-CA": "Idole des immolés",
    "it": "Idolo dell'immolato",
    "ja": "捧げられし者の偶像",
    "ko": "분신한 번제의 우상",
    "nl": "Afgod van de brandoffers",
    "pt-BR": "Ídolo dos Imolados",
    "ru": "Идол закланных",
    "tr": "Ateş Kurbanı Heykelciği",
    "zh-CN": "祭品神像",
    "zh-TW": "祭品神像"
  },
  "namePlain": {
    "ar": "تمثال الموت حرقًا",
    "de": "Idol der Geopferten",
    "en": "Idol of the Immolated",
    "es": "Ídolo del sacrificado",
    "fr": "Idole des immolés",
    "fr-CA": "Idole des immolés",
    "it": "Idolo dell'immolato",
    "ja": "捧げられし者の偶像",
    "ko": "분신한 번제의 우상",
    "nl": "Afgod van de brandoffers",
    "pt-BR": "Ídolo dos Imolados",
    "ru": "Идол закланных",
    "tr": "Ateş Kurbanı Heykelciği",
    "zh-CN": "祭品神像",
    "zh-TW": "祭品神像"
  },
  "requiresCult": false,
  "subType": "Any",
  "thumb": "icons/relics/64/FieryBlood.png",
  "unlockedBy": "Building_LightningRod",
  "weight": 1.0
}
