{
  "chargeCategory": "Slow",
  "chargeDamage": 110.0,
  "coop": false,
  "damageType": "NoDamage",
  "description": {
    "ar": "يمكن اكتساب 8 ثوانٍ من الحصانة.",
    "de": "Erhalte 8 Sekunden der Unverwundbarkeit.",
    "en": "Gain 8 seconds of invincibility.",
    "es": "Gana 8 segundos de invencibilidad.",
    "fr": "Obtenez 8 secondes d'invincibilité.",
    "fr-CA": "Obtenez 8 secondes d'invincibilité.",
    "it": "Conferisce 8 secondi di invincibilità.",
    "ja": "8秒間無敵状態になる",
    "ko": "8초 동안 무적이 됩니다.",
    "nl": "Word 8 seconden onoverwinnelijk.",
    "pt-BR": "Ganhe 8 segundos de invencibilidade.",
    "ru": "Вы становитесь неуязвимы на 8 сек.",
    "tr": "8 saniyeliğine hasar görmez olursun.",
    "zh-CN": "获得 8 秒无敌状态。",
    "zh-TW": "獲得 8 秒無敵狀態。"
  },
  "descriptionPlain": {
    "ar": "يمكن اكتساب 8 ثوانٍ من الحصانة.",
    "de": "Erhalte 8 Sekunden der Unverwundbarkeit.",
    "en": "Gain 8 seconds of invincibility.",
    "es": "Gana 8 segundos de invencibilidad.",
    "fr": "Obtenez 8 secondes d'invincibilité.",
    "fr-CA": "Obtenez 8 secondes d'invincibilité.",
    "it": "Conferisce 8 secondi di invincibilità.",
    "ja": "8秒間無敵状態になる",
    "ko": "8초 동안 무적이 됩니다.",
    "nl": "Word 8 seconden onoverwinnelijk.",
    "pt-BR": "Ganhe 8 segundos de invencibilidade.",
    "ru": "Вы становитесь неуязвимы на 8 сек.",
    "tr": "8 saniyeliğine hasar görmez olursun.",
    "zh-CN": "获得 8 秒无敌状态。",
    "zh-TW": "獲得 8 秒無敵狀態。"
  },
  "dlc": false,
  "icon": "icons/relics/GungeonBlank.png",
  "id": "GungeonBlank",
  "interactionType": "Charging",
  "lore": {
    "ar": "لا أدبّر شرًا.",
    "de": "Nichts Böses denken.",
    "en": "Think no evil.",
    "es": "No pensar el Mal.",
    "fr": "Ne pas penser le mal.",
    "fr-CA": "Ne pas penser le mal.",
    "it": "Ho smesso di pensare.",
    "ja": "悪を考えず",
    "ko": "악을 생각하지 말지어다.",
    "nl": "Denk geen kwaad.",
    "pt-BR": "Não pense em mal algum.",
    "ru": "Не думать о зле.",
    "tr": "Akılsız kötülük.",
    "zh-CN": "毋思恶。",
    "zh-TW": "毋思惡。"
  },
  "majorDlc": false,
  "name": {
    "ar": "جمجمة شامورا",
    "de": "Shamuras Schädel",
    "en": "Shamura's Skull",
    "es": "Calavera de Shamura",
    "fr": "Crâne de Shamura",
    "fr-CA": "Crâne de Shamura",
    "it": "Teschio di Shamura",
    "ja": "シャムラの頭蓋骨",
    "ko": "샤무라의 해골",
    "nl": "Schedel van Shamura",
    "pt-BR": "Crânio de Shamura",
    "ru": "Череп Шамуры",
    "tr": "Shamura'nın Kafatası",
    "zh-CN": "沙穆拉之颅",
    "zh-TW": "夏慕拉之顱"
  },
  "namePlain": {
    "ar": "جمجمة شامورا",
    "de": "Shamuras Schädel",
    "en": "Shamura's Skull",
    "es": "Calavera de Shamura",
    "fr": "Crâne de Shamura",
    "fr-CA": "Crâne de Shamura",
    "it": "Teschio di Shamura",
    "ja": "シャムラの頭蓋骨",
    "ko": "샤무라의 해골",
    "nl": "Schedel van Shamura",
    "pt-BR": "Crânio de Shamura",
    "ru": "Череп Шамуры",
    "tr": "Shamura'nın Kafatası",
    "zh-CN": "沙穆拉之颅",
    "zh-TW": "夏慕拉之顱"
  },
  "requiresCult": false,
  "subType": "Any",
  "thumb": "icons/relics/64/GungeonBlank.png",
  "unlockedBy": "Building_LightningRod",
  "weight": 1.0
}
