{
  "chargeCategory": "Slow",
  "chargeDamage": 100.0,
  "coop": false,
  "damageType": "DealsDamage",
  "description": {
    "ar": "يمكن استدعاء تابع حي لمساعدتك حتى موته في حملتك.",
    "de": "Beschwöre einen untoten Anhänger, um dir auf deinem Kreuzzug zu helfen.",
    "en": "Summon an undead Follower to help you in your Crusade.",
    "es": "Invoca a un adepto no muerto para que te ayude en tu cruzada.",
    "fr": "Invoquez un adepte mort-vivant pour vous accompagner dans les donjons.",
    "fr-CA": "Invoquez un adepte mort-vivant pour vous accompagner lors de vos croisades.",
    "it": "Evoca un membro del Culto non morto per assisterti nella crociata.",
    "ja": "聖戦を手助けしてくれる信者の死霊を召喚する",
    "ko": "언데드 추종자 하나를 소환해 성전에서 돕게 합니다.",
    "nl": "Roep een ondode volgeling op om je te helpen in je kruistocht.",
    "pt-BR": "Invoque um Seguidor morto-vivo para lhe ajudar na sua Cruzada.",
    "ru": "Вы призываете умершего последователя, который будет помогать вам в походе.",
    "tr": "Sefer'inde sana yardımcı olması için bir hortlak Takipçi çağırır.",
    "zh-CN": "召唤一位不死的教徒，在圣战中帮助你。",
    "zh-TW": "召喚一位不死的教徒，在聖戰中幫助你。"
  },
  "descriptionPlain": {
    "ar": "يمكن استدعاء تابع حي لمساعدتك حتى موته في حملتك.",
    "de": "Beschwöre einen untoten Anhänger, um dir auf deinem Kreuzzug zu helfen.",
    "en": "Summon an undead Follower to help you in your Crusade.",
    "es": "Invoca a un adepto no muerto para que te ayude en tu cruzada.",
    "fr": "Invoquez un adepte mort-vivant pour vous accompagner dans les donjons.",
    "fr-CA": "Invoquez un adepte mort-vivant pour vous accompagner lors de vos croisades.",
    "it": "Evoca un membro del Culto non morto per assisterti nella crociata.",
    "ja": "聖戦を手助けしてくれる信者の死霊を召喚する",
    "ko": "언데드 추종자 하나를 소환해 성전에서 돕게 합니다.",
    "nl": "Roep een ondode volgeling op om je te helpen in je kruistocht.",
    "pt-BR": "Invoque um Seguidor morto-vivo para lhe ajudar na sua Cruzada.",
    "ru": "Вы призываете умершего последователя, который будет помогать вам в походе.",
    "tr": "Sefer'inde sana yardımcı olması için bir hortlak Takipçi çağırır.",
    "zh-CN": "召唤一位不死的教徒，在圣战中帮助你。",
    "zh-TW": "召喚一位不死的教徒，在聖戰中幫助你。"
  },
  "dlc": false,
  "icon": "icons/relics/SpawnCombatFollower.png",
  "id": "SpawnCombatFollower",
  "interactionType": "Charging",
  "lore": {
    "ar": "لا أسمع شرًا.",
    "de": "Nichts Böses hören.",
    "en": "Hear no evil.",
    "es": "No escuchar el Mal.",
    "fr": "Ne pas entendre le mal.",
    "fr-CA": "Ne pas entendre le mal.",
    "it": "\"Non sento\".",
    "ja": "悪を聞かず",
    "ko": "악을 듣지 말지어다.",
    "nl": "Hoor geen kwaad.",
    "pt-BR": "Não ouça mal algum.",
    "ru": "Не слышать зла.",
    "tr": "Sağır kötülük.",
    "zh-CN": "毋闻恶。",
    "zh-TW": "毋聞惡。"
  },
  "majorDlc": false,
  "name": {
    "ar": "أذن كالامار",
    "de": "Kallamars Ohr",
    "en": "Kallamar's Ear",
    "es": "Oreja de Kallamar",
    "fr": "Oreille de Kallamar",
    "fr-CA": "Oreille de Kallamar",
    "it": "Orecchio di Kallamar",
    "ja": "カラマールの耳",
    "ko": "칼라마르의 귀",
    "nl": "Kallamars oor",
    "pt-BR": "Orelha de Kallamar",
    "ru": "Ухо Калламара",
    "tr": "Kallamar'ın Kulağı",
    "zh-CN": "凯拉鰢之耳",
    "zh-TW": "凱拉鰢之耳"
  },
  "namePlain": {
    "ar": "أذن كالامار",
    "de": "Kallamars Ohr",
    "en": "Kallamar's Ear",
    "es": "Oreja de Kallamar",
    "fr": "Oreille de Kallamar",
    "fr-CA": "Oreille de Kallamar",
    "it": "Orecchio di Kallamar",
    "ja": "カラマールの耳",
    "ko": "칼라마르의 귀",
    "nl": "Kallamars oor",
    "pt-BR": "Orelha de Kallamar",
    "ru": "Ухо Калламара",
    "tr": "Kallamar'ın Kulağı",
    "zh-CN": "凯拉鰢之耳",
    "zh-TW": "凱拉鰢之耳"
  },
  "requiresCult": false,
  "subType": "Any",
  "thumb": "icons/relics/64/SpawnCombatFollower.png",
  "unlockedBy": "Building_LightningRod",
  "weight": 1.0
}
