{
  "chargeCategory": "Average",
  "chargeDamage": 70.0,
  "coop": false,
  "damageType": "NoDamage",
  "description": {
    "ar": "يزيد ضرر الهجوم لمدة 10 ثوانٍ.",
    "de": "Erhöhe 10 Sekunden lang den Angriffsschaden.",
    "en": "Increases attack damage for 10 seconds.",
    "es": "Aumenta el daño de tus ataques durante 10 segundos.",
    "fr": "Augmentez vos dégâts infligés pendant 10 secondes.",
    "fr-CA": "Augmentez vos dégâts infligés pendant 10 secondes.",
    "it": "Aumenta i danni che infliggi per 10 secondi.",
    "ja": "10秒間、攻撃で与えるダメージが上昇する",
    "ko": "10초 간 공격력을 증가시킵니다.",
    "nl": "Verhoogt 10 seconden lang aanvalsschade.",
    "pt-BR": "Aumenta o dano do ataque por 10 segundos.",
    "ru": "Вы наносите больше урона в течение 10 сек.",
    "tr": "Saldırı hasarını 10 saniyeliğine artırır.",
    "zh-CN": "增加攻击伤害值 10 秒。",
    "zh-TW": "增加攻擊傷害值 10 秒。"
  },
  "descriptionPlain": {
    "ar": "يزيد ضرر الهجوم لمدة 10 ثوانٍ.",
    "de": "Erhöhe 10 Sekunden lang den Angriffsschaden.",
    "en": "Increases attack damage for 10 seconds.",
    "es": "Aumenta el daño de tus ataques durante 10 segundos.",
    "fr": "Augmentez vos dégâts infligés pendant 10 secondes.",
    "fr-CA": "Augmentez vos dégâts infligés pendant 10 secondes.",
    "it": "Aumenta i danni che infliggi per 10 secondi.",
    "ja": "10秒間、攻撃で与えるダメージが上昇する",
    "ko": "10초 간 공격력을 증가시킵니다.",
    "nl": "Verhoogt 10 seconden lang aanvalsschade.",
    "pt-BR": "Aumenta o dano do ataque por 10 segundos.",
    "ru": "Вы наносите больше урона в течение 10 сек.",
    "tr": "Saldırı hasarını 10 saniyeliğine artırır.",
    "zh-CN": "增加攻击伤害值 10 秒。",
    "zh-TW": "增加攻擊傷害值 10 秒。"
  },
  "dlc": false,
  "icon": "icons/relics/IncreaseDamageForDuration.png",
  "id": "IncreaseDamageForDuration",
  "interactionType": "Charging",
  "lore": {
    "ar": "لا أنطق شرًا.",
    "de": "Nichts Böses sagen.",
    "en": "Speak no evil.",
    "es": "No decir el Mal.",
    "fr": "Ne pas dire le mal.",
    "fr-CA": "Ne pas dire le mal.",
    "it": "\"Non parlo\".",
    "ja": "悪を語らず",
    "ko": "악을 말하지 말지어다.",
    "nl": "Spreek geen kwaad.",
    "pt-BR": "Não fale mal algum.",
    "ru": "Не говорить о зле.",
    "tr": "Dilsiz kötülük.",
    "zh-CN": "毋言恶。",
    "zh-TW": "毋言惡。"
  },
  "majorDlc": false,
  "name": {
    "ar": "حلق هيكت",
    "de": "Hekets Kehle",
    "en": "Heket's Throat",
    "es": "Garganta de Heket",
    "fr": "Gorge de Heket",
    "fr-CA": "Gorge de Heket",
    "it": "Gola di Heket",
    "ja": "ヘケトの喉",
    "ko": "헤켓의 목젖",
    "nl": "Hekets keel",
    "pt-BR": "Garganta de Heket",
    "ru": "Связки Хекат",
    "tr": "Heket'in Boğazı",
    "zh-CN": "赫凯特之喉",
    "zh-TW": "赫凱特之喉"
  },
  "namePlain": {
    "ar": "حلق هيكت",
    "de": "Hekets Kehle",
    "en": "Heket's Throat",
    "es": "Garganta de Heket",
    "fr": "Gorge de Heket",
    "fr-CA": "Gorge de Heket",
    "it": "Gola di Heket",
    "ja": "ヘケトの喉",
    "ko": "헤켓의 목젖",
    "nl": "Hekets keel",
    "pt-BR": "Garganta de Heket",
    "ru": "Связки Хекат",
    "tr": "Heket'in Boğazı",
    "zh-CN": "赫凯特之喉",
    "zh-TW": "赫凱特之喉"
  },
  "requiresCult": false,
  "subType": "Any",
  "thumb": "icons/relics/64/IncreaseDamageForDuration.png",
  "unlockedBy": "Building_LightningRod",
  "weight": 1.0
}
