{
  "chargeCategory": "Fast",
  "chargeDamage": 30.0,
  "coop": false,
  "damageType": "NoDamage",
  "description": {
    "ar": "يمكن اكتساب نصف قلب روح مقابل كل تابع معارض.",
    "de": "Erhalte ein halbes Geisterherz pro abtrünnigem Anhänger.",
    "en": "Gain half a Spirit Heart per Dissenting Follower.",
    "es": "Gana medio corazón fantasma por cada adepto desertor.",
    "fr": "Obtenez une moitié de cœur spirituel par adepte rebelle.",
    "fr-CA": "Obtenez une moitié de cœur spirituel par adepte rebelle.",
    "it": "Conferisce mezzo cuore spirituale per ogni membro dissidente del Culto.",
    "ja": "離反中の信者1人につき、半分のスピリットハートを獲得する",
    "ko": "반목하는 추종자 하나당 영혼 심장 하나를 얻습니다.",
    "nl": "Krijg een half spiritueel hart per afvallige volgeling.",
    "pt-BR": "Ganhe meio Coração Espiritual por Seguidor Rebelde.",
    "ru": "Вы получаете по половине эфемерного сердца за каждого инакомыслящего последователя.",
    "tr": "Tarikat'ındaki Başkaldıran Takipçi başına bir yarım Ruh Kalbi kazanırsın.",
    "zh-CN": "教中每有一位反教者，就获得半颗灵心。",
    "zh-TW": "教中每有一位反教者，就獲得半顆靈心。"
  },
  "descriptionPlain": {
    "ar": "يمكن اكتساب نصف قلب روح مقابل كل تابع معارض.",
    "de": "Erhalte ein halbes Geisterherz pro abtrünnigem Anhänger.",
    "en": "Gain half a Spirit Heart per Dissenting Follower.",
    "es": "Gana medio corazón fantasma por cada adepto desertor.",
    "fr": "Obtenez une moitié de cœur spirituel par adepte rebelle.",
    "fr-CA": "Obtenez une moitié de cœur spirituel par adepte rebelle.",
    "it": "Conferisce mezzo cuore spirituale per ogni membro dissidente del Culto.",
    "ja": "離反中の信者1人につき、半分のスピリットハートを獲得する",
    "ko": "반목하는 추종자 하나당 영혼 심장 하나를 얻습니다.",
    "nl": "Krijg een half spiritueel hart per afvallige volgeling.",
    "pt-BR": "Ganhe meio Coração Espiritual por Seguidor Rebelde.",
    "ru": "Вы получаете по половине эфемерного сердца за каждого инакомыслящего последователя.",
    "tr": "Tarikat'ındaki Başkaldıran Takipçi başına bir yarım Ruh Kalbi kazanırsın.",
    "zh-CN": "教中每有一位反教者，就获得半颗灵心。",
    "zh-TW": "教中每有一位反教者，就獲得半顆靈心。"
  },
  "dlc": false,
  "icon": "icons/relics/HealPerFollower_Dammed.png",
  "id": "HealPerFollower_Dammed",
  "interactionType": "Fragile",
  "lore": {
    "ar": "حتى الشك قد يكون له فائدة.",
    "de": "Selbst der Zweifel kann nützlich sein.",
    "en": "Even doubt may have its use.",
    "es": "Incluso la duda alberga sus usos.",
    "fr": "Même le doute peut avoir ses avantages.",
    "fr-CA": "Même le doute peut avoir ses avantages.",
    "it": "Persino il dubbio può avere una sua utilità.",
    "ja": "疑念の心にも、使い道があるのだ",
    "ko": "의심 또한 쓰일 곳이 있나니.",
    "nl": "Zelfs twijfel kan nut hebben.",
    "pt-BR": "Até a dúvida pode ser útil.",
    "ru": "Даже в сомнении есть польза.",
    "tr": "Bazen kuşkunun bile faydası vardır.",
    "zh-CN": "就连质疑也可能有其用处。",
    "zh-TW": "就連質疑也可能有其用處。"
  },
  "majorDlc": false,
  "name": {
    "ar": "بلسم المعتزِل <color=#FD1D03>الملعون</color>",
    "de": "<color=#FD1D03>Verdammter</color> Balsam des Einsiedlers",
    "en": "<color=#FD1D03>Damned</color> Balm of the Anchorite",
    "es": "Bálsamo <color=#FD1D03>maldito</color> del ermitaño",
    "fr": "Baume de l'anachorète <color=#FD1D03>maudit</color>",
    "fr-CA": "Baume <color=#FD1D03>maudit</color> de l'anachorète",
    "it": "Balsamo dell'anacoreta <color=#FD1D03>dannato</color>",
    "ja": "<color=#FD1D03>呪われた</color>隠者の香油",
    "ko": "<color=#FD1D03>저주받은</color> 은자의 연고",
    "nl": "<color=#FD1D03>Verdoemde</color> balsem van de Anchoriet",
    "pt-BR": "Bálsamo do Anacoreta <color=#FD1D03>Maldito</color>",
    "ru": "<color=#FD1D03>Проклятый</color> бальзам аскета",
    "tr": "<color=#FD1D03>Lanetli</color> Münzevinin Merhemi",
    "zh-CN": "<color=#FD1D03>受诅咒的</color>隐修者香膏",
    "zh-TW": "<color=#FD1D03>受詛咒的</color>隱修者香膏"
  },
  "namePlain": {
    "ar": "بلسم المعتزِل الملعون",
    "de": "Verdammter Balsam des Einsiedlers",
    "en": "Damned Balm of the Anchorite",
    "es": "Bálsamo maldito del ermitaño",
    "fr": "Baume de l'anachorète maudit",
    "fr-CA": "Baume maudit de l'anachorète",
    "it": "Balsamo dell'anacoreta dannato",
    "ja": "呪われた隠者の香油",
    "ko": "저주받은 은자의 연고",
    "nl": "Verdoemde balsem van de Anchoriet",
    "pt-BR": "Bálsamo do Anacoreta Maldito",
    "ru": "Проклятый бальзам аскета",
    "tr": "Lanetli Münzevinin Merhemi",
    "zh-CN": "受诅咒的隐修者香膏",
    "zh-TW": "受詛咒的隱修者香膏"
  },
  "requiresCult": true,
  "subType": "Any",
  "thumb": "icons/relics/64/HealPerFollower_Dammed.png",
  "unlockedBy": "Relics_Dammed_1",
  "weight": 1.0
}
