{
  "chargeCategory": "Average",
  "chargeDamage": 60.0,
  "coop": false,
  "damageType": "NoDamage",
  "description": {
    "ar": "يمكن <color=#f79502>حرق</color> جميع الأعداء النشطين.",
    "de": "<color=#f79502>Verbrenne</color> alle aktiven Gegner.",
    "en": "<color=#f79502>Burn</color> all active enemies.",
    "es": "<color=#f79502>Quema</color> a todos los enemigos activos.",
    "fr": "<color=#f79502>Brûle</color> tous les ennemis présents.",
    "fr-CA": "<color=#f79502>Brûle</color> tous les ennemis présents.",
    "it": "<color=#f79502>Incendia</color> tutti i nemici a schermo.",
    "ja": "画面内の敵すべてを<color=#f79502>炎上</color>状態にする",
    "ko": "모든 활동 중의 적들을 <color=#f79502>불태웁니다.</color>",
    "nl": "<color=#f79502>Verbrand</color> alle actieve vijanden.",
    "pt-BR": "<color=#f79502>Queima</color> todos os inimigos ativos.",
    "ru": "Вы <color=#f79502>поджигаете</color> всех врагов.",
    "tr": "Tüm etkin düşmanları <color=#f79502>yakar</color>.",
    "zh-CN": "使所有行动中的敌人<color=#f79502>燃烧</color>。",
    "zh-TW": "使所有行動中的敵人<color=#f79502>燃燒</color>。"
  },
  "descriptionPlain": {
    "ar": "يمكن حرق جميع الأعداء النشطين.",
    "de": "Verbrenne alle aktiven Gegner.",
    "en": "Burn all active enemies.",
    "es": "Quema a todos los enemigos activos.",
    "fr": "Brûle tous les ennemis présents.",
    "fr-CA": "Brûle tous les ennemis présents.",
    "it": "Incendia tutti i nemici a schermo.",
    "ja": "画面内の敵すべてを炎上状態にする",
    "ko": "모든 활동 중의 적들을 불태웁니다.",
    "nl": "Verbrand alle actieve vijanden.",
    "pt-BR": "Queima todos os inimigos ativos.",
    "ru": "Вы поджигаете всех врагов.",
    "tr": "Tüm etkin düşmanları yakar.",
    "zh-CN": "使所有行动中的敌人燃烧。",
    "zh-TW": "使所有行動中的敵人燃燒。"
  },
  "dlc": true,
  "icon": "icons/relics/IgniteAll.png",
  "id": "IgniteAll",
  "interactionType": "Charging",
  "lore": {
    "ar": "السم الذي يحرق من الأعماق إلى السطح.",
    "de": "Gift, das von innen heraus brennt.",
    "en": "Venom that burns from the inside out.",
    "es": "Un veneno que abrasa desde las entrañas.",
    "fr": "Un venin qui brûle de l'intérieur.",
    "fr-CA": "Un venin qui brûle de l'intérieur.",
    "it": "Un fuoco che divampa dall'interno.",
    "ja": "その毒はことごとくを焼き尽くす",
    "ko": "내면에서부터 태워버리는 맹독.",
    "nl": "Vergif dat van binnen naar buiten brandt.",
    "pt-BR": "Um veneno que queima por dentro.",
    "ru": "Горючий яд, изливающийся наружу.",
    "tr": "İçten yakan bir zehir.",
    "zh-CN": "由内而外燃烧的剧毒。",
    "zh-TW": "由內而外燃燒的劇毒。"
  },
  "majorDlc": true,
  "name": {
    "ar": "شوكة أصحاب الجمرات",
    "de": "Stachel des Aschenvolks",
    "en": "Spine of the Cinderfolk",
    "es": "Púa de los cinéreos",
    "fr": "Épine de Cendréen",
    "fr-CA": "Épine de Cendréen",
    "it": "Aculeo del Cineride",
    "ja": "灰者の棘",
    "ko": "잔불사람의 척추",
    "nl": "Stekel van het Sintelvolk",
    "pt-BR": "Espinhos em Brasa",
    "ru": "Хребет уголита",
    "tr": "Külzade Omurgası",
    "zh-CN": "灰烬者之脊",
    "zh-TW": "灰燼者之脊"
  },
  "namePlain": {
    "ar": "شوكة أصحاب الجمرات",
    "de": "Stachel des Aschenvolks",
    "en": "Spine of the Cinderfolk",
    "es": "Púa de los cinéreos",
    "fr": "Épine de Cendréen",
    "fr-CA": "Épine de Cendréen",
    "it": "Aculeo del Cineride",
    "ja": "灰者の棘",
    "ko": "잔불사람의 척추",
    "nl": "Stekel van het Sintelvolk",
    "pt-BR": "Espinhos em Brasa",
    "ru": "Хребет уголита",
    "tr": "Külzade Omurgası",
    "zh-CN": "灰烬者之脊",
    "zh-TW": "灰燼者之脊"
  },
  "requiresCult": false,
  "subType": "Any",
  "thumb": "icons/relics/64/IgniteAll.png",
  "unlockedBy": "Relics_Fire",
  "weight": 1.0
}
