{
  "chargeCategory": "Average",
  "chargeDamage": 70.0,
  "coop": false,
  "damageType": "NoDamage",
  "description": {
    "ar": "يمكن استدعاء سلاح جديد بمستوى زائد.",
    "de": "Beschwöre eine neue Waffe mit erhöhter Stufe.",
    "en": "Summon a new Weapon with an increased level.",
    "es": "Invoca un arma nueva de más nivel.",
    "fr": "Invoquez une nouvelle arme d'un niveau supérieur.",
    "fr-CA": "Invoquez une nouvelle arme d'un niveau supérieur.",
    "it": "Evoca una nuova arma di livello superiore.",
    "ja": "レベルがより高い武器を召喚する",
    "ko": "레벨이 상승한 새로운 무기 하나를 소환합니다.",
    "nl": "Roep een nieuw wapen op van een hoger level.",
    "pt-BR": "Invoque uma nova Arma com o nível aumentado.",
    "ru": "Вы призываете новое оружие повышенного уровня.",
    "tr": "Bir üst seviyeli yeni bir Silah çağırır.",
    "zh-CN": "召唤一把等级提升过的新武器。",
    "zh-TW": "召喚一把等級提升過的新武器。"
  },
  "descriptionPlain": {
    "ar": "يمكن استدعاء سلاح جديد بمستوى زائد.",
    "de": "Beschwöre eine neue Waffe mit erhöhter Stufe.",
    "en": "Summon a new Weapon with an increased level.",
    "es": "Invoca un arma nueva de más nivel.",
    "fr": "Invoquez une nouvelle arme d'un niveau supérieur.",
    "fr-CA": "Invoquez une nouvelle arme d'un niveau supérieur.",
    "it": "Evoca una nuova arma di livello superiore.",
    "ja": "レベルがより高い武器を召喚する",
    "ko": "레벨이 상승한 새로운 무기 하나를 소환합니다.",
    "nl": "Roep een nieuw wapen op van een hoger level.",
    "pt-BR": "Invoque uma nova Arma com o nível aumentado.",
    "ru": "Вы призываете новое оружие повышенного уровня.",
    "tr": "Bir üst seviyeli yeni bir Silah çağırır.",
    "zh-CN": "召唤一把等级提升过的新武器。",
    "zh-TW": "召喚一把等級提升過的新武器。"
  },
  "dlc": false,
  "icon": "icons/relics/RerollWeapon.png",
  "id": "RerollWeapon",
  "interactionType": "Charging",
  "lore": {
    "ar": "مخلب قاتل وحاد كالسكاكين.",
    "de": "Bösartige Klaue, sündhaft scharf.",
    "en": "Vicious claw, wickedly sharp.",
    "es": "Garra salvaje, asaz afilada.",
    "fr": "Une griffe vicieusement aiguisée.",
    "fr-CA": "Une griffe vicieusement aiguisée.",
    "it": "Un artiglio feroce, perfidamente affilato.",
    "ja": "悪意に満ちたその爪は、邪悪なほどに鋭い",
    "ko": "잔혹한 발톱, 사악할만치 날카롭다.",
    "nl": "Venijnige klauw, verraderlijk scherp.",
    "pt-BR": "Uma garra feroz, terrivelmente afiada.",
    "ru": "Бритвенно-острый коготь отмщения.",
    "tr": "Hainlikle bilenmiş, vahşi bir pençe.",
    "zh-CN": "凶残之爪，异常锐利。",
    "zh-TW": "凶殘之爪，異常銳利。"
  },
  "majorDlc": false,
  "name": {
    "ar": "ظفر إصبع كوداي",
    "de": "Kudaais Fingernagel",
    "en": "Kudaai's Fingernail",
    "es": "Uña de la mano de Kudaai",
    "fr": "Ongle de Kudaai",
    "fr-CA": "Ongle de Kudaai",
    "it": "Unghia di Kudaai",
    "ja": "クダーイの手爪",
    "ko": "쿠다이의 손톱",
    "nl": "Kudaais vingernagel",
    "pt-BR": "Unha de Kudaai",
    "ru": "Ноготь с руки Кыдая",
    "tr": "Kudaai'nin Tırnağı",
    "zh-CN": "库鐽伊之指甲",
    "zh-TW": "庫鐽伊之指甲"
  },
  "namePlain": {
    "ar": "ظفر إصبع كوداي",
    "de": "Kudaais Fingernagel",
    "en": "Kudaai's Fingernail",
    "es": "Uña de la mano de Kudaai",
    "fr": "Ongle de Kudaai",
    "fr-CA": "Ongle de Kudaai",
    "it": "Unghia di Kudaai",
    "ja": "クダーイの手爪",
    "ko": "쿠다이의 손톱",
    "nl": "Kudaais vingernagel",
    "pt-BR": "Unha de Kudaai",
    "ru": "Ноготь с руки Кыдая",
    "tr": "Kudaai'nin Tırnağı",
    "zh-CN": "库鐽伊之指甲",
    "zh-TW": "庫鐽伊之指甲"
  },
  "requiresCult": false,
  "subType": "Any",
  "thumb": "icons/relics/64/RerollWeapon.png",
  "unlockedBy": "Building_LightningRod",
  "weight": 1.0
}
