{
  "chargeCategory": "Fast",
  "chargeDamage": 30.0,
  "coop": false,
  "damageType": "NoDamage",
  "description": {
    "ar": "يمكن اكتساب نصف قلب روح مقابل كل تابع مسن.",
    "de": "Erhalte ein halbes Geisterherz pro Ältester-Anhänger.",
    "en": "Gain half a Spirit Heart per Elderly Follower.",
    "es": "Gana medio corazón fantasma por cada adepto anciano.",
    "fr": "Obtenez une moitié de cœur spirituel par adepte âgé.",
    "fr-CA": "Obtenez une moitié de cœur spirituel par adepte âgé.",
    "it": "Conferisce mezzo cuore spirituale per ogni membro anziano del Culto.",
    "ja": "高齢の信者1人につき、半分のスピリットハートを獲得する",
    "ko": "노인 추종자 하나당 영혼 심장 반쪽을 얻습니다.",
    "nl": "Krijg een half spiritueel hart per bejaarde volgeling.",
    "pt-BR": "Ganhe meio Coração Espiritual por Seguidor Idoso.",
    "ru": "Вы получаете по половине эфемерного сердца за каждого пожилого последователя.",
    "tr": "Tarikat'ındaki İhtiyar Takipçi başına bir yarım Ruh Kalbi kazanırsın.",
    "zh-CN": "教中每有一位年长教徒，就获得半颗灵心。",
    "zh-TW": "教中每有一位年長教徒，就獲得半顆靈心。"
  },
  "descriptionPlain": {
    "ar": "يمكن اكتساب نصف قلب روح مقابل كل تابع مسن.",
    "de": "Erhalte ein halbes Geisterherz pro Ältester-Anhänger.",
    "en": "Gain half a Spirit Heart per Elderly Follower.",
    "es": "Gana medio corazón fantasma por cada adepto anciano.",
    "fr": "Obtenez une moitié de cœur spirituel par adepte âgé.",
    "fr-CA": "Obtenez une moitié de cœur spirituel par adepte âgé.",
    "it": "Conferisce mezzo cuore spirituale per ogni membro anziano del Culto.",
    "ja": "高齢の信者1人につき、半分のスピリットハートを獲得する",
    "ko": "노인 추종자 하나당 영혼 심장 반쪽을 얻습니다.",
    "nl": "Krijg een half spiritueel hart per bejaarde volgeling.",
    "pt-BR": "Ganhe meio Coração Espiritual por Seguidor Idoso.",
    "ru": "Вы получаете по половине эфемерного сердца за каждого пожилого последователя.",
    "tr": "Tarikat'ındaki İhtiyar Takipçi başına bir yarım Ruh Kalbi kazanırsın.",
    "zh-CN": "教中每有一位年长教徒，就获得半颗灵心。",
    "zh-TW": "教中每有一位年長教徒，就獲得半顆靈心。"
  },
  "dlc": false,
  "icon": "icons/relics/HealPerFollower_Blessed.png",
  "id": "HealPerFollower_Blessed",
  "interactionType": "Fragile",
  "lore": {
    "ar": "لن يتركونا أبدًا.",
    "de": "Mögen sie uns nie verlassen.",
    "en": "They shall never leave us.",
    "es": "Jamás nos abandonarán.",
    "fr": "Ils ne partiront jamais vraiment.",
    "fr-CA": "Ils ne partiront jamais vraiment.",
    "it": "Saranno sempre con noi.",
    "ja": "彼らが我らを見捨てることはない",
    "ko": "그들은 우리를 떠나지 않을 터.",
    "nl": "Ze zullen ons nooit verlaten.",
    "pt-BR": "Eles nunca nos deixarão.",
    "ru": "Да не оставят они нас.",
    "tr": "Bizi asla terk etmeyecekler.",
    "zh-CN": "愿那些人永不离开我们。",
    "zh-TW": "願那些人永不離開我們。"
  },
  "majorDlc": false,
  "name": {
    "ar": "بلسم المعتزِل <color=#03EAFD>المبارك</color>",
    "de": "<color=#03EAFD>Gesegneter</color> Balsam des Einsiedlers",
    "en": "<color=#03EAFD>Blessed</color> Balm of the Anchorite",
    "es": "Bálsamo <color=#03EAFD>bendecido</color> del ermitaño",
    "fr": "Baume de l'anachorète <color=#03EAFD>béni</color>",
    "fr-CA": "Baume <color=#03EAFD>béni</color> de l'anachorète",
    "it": "Balsamo dell'anacoreta <color=#03EAFD>benedetto</color>",
    "ja": "<color=#03EAFD>祝福された</color>隠者の香油",
    "ko": "<color=#03EAFD>축복받은</color> 은자의 연고",
    "nl": "<color=#03EAFD>Gezegende</color> balsem van de Anchoriet",
    "pt-BR": "Bálsamo do Anacoreta <color=#03EAFD>Abençoado</color>",
    "ru": "<color=#03EAFD>Священный</color> бальзам аскета",
    "tr": "<color=#03EAFD>Kutsanmış</color> Münzevinin Merhemi",
    "zh-CN": "<color=#03EAFD>受祝福的</color>隐修者香膏",
    "zh-TW": "<color=#03EAFD>受祝福的</color>隱修者香膏"
  },
  "namePlain": {
    "ar": "بلسم المعتزِل المبارك",
    "de": "Gesegneter Balsam des Einsiedlers",
    "en": "Blessed Balm of the Anchorite",
    "es": "Bálsamo bendecido del ermitaño",
    "fr": "Baume de l'anachorète béni",
    "fr-CA": "Baume béni de l'anachorète",
    "it": "Balsamo dell'anacoreta benedetto",
    "ja": "祝福された隠者の香油",
    "ko": "축복받은 은자의 연고",
    "nl": "Gezegende balsem van de Anchoriet",
    "pt-BR": "Bálsamo do Anacoreta Abençoado",
    "ru": "Священный бальзам аскета",
    "tr": "Kutsanmış Münzevinin Merhemi",
    "zh-CN": "受祝福的隐修者香膏",
    "zh-TW": "受祝福的隱修者香膏"
  },
  "requiresCult": true,
  "subType": "Any",
  "thumb": "icons/relics/64/HealPerFollower_Blessed.png",
  "unlockedBy": "Relics_Blessed_1",
  "weight": 1.0
}
