{
  "chargeCategory": "Average",
  "chargeDamage": 75.0,
  "coop": false,
  "damageType": "DealsDamage",
  "description": {
    "ar": "يمكن إلحاق الضرر بجميع الأعداء وفقًا لعدد أتباعك المعارضين.",
    "de": "Füge allen Gegnern entsprechend der Anzahl deiner abtrünnigen Anhänger Schaden zu.",
    "en": "Damage all enemies based on how many Dissenting Followers you have.",
    "es": "Inflige daño a todos los enemigos en función del número de adeptos desertores que tengas.",
    "fr": "Infligez des dégâts à tous les ennemis selon votre nombre d'adeptes rebelles.",
    "fr-CA": "Infligez des dégâts à tous les ennemis selon votre nombre d'adeptes rebelles.",
    "it": "Infligge danni a tutti i nemici in base al numero dei membri dissidenti del Culto.",
    "ja": "教団に所属している離反中の信者の人数に応じたダメージを敵全体に与える",
    "ko": "보유한 반목 중인 추종자들의 수에 비례해 모든 적에게 피해를 줍니다.",
    "nl": "Breng schade toe aan alle vijanden op basis van het aantal afvallige volgelingen dat je hebt.",
    "pt-BR": "Cause dano a todos os inimigos com base na sua quantidade de Seguidores Rebeldes.",
    "ru": "Вы наносите врагам урон, зависящий от количества инакомыслящих последователей.",
    "tr": "Sahip olduğun Başkaldıran Takipçi sayısına bağlı olarak tüm düşmanlara hasar verir.",
    "zh-CN": "根据你的反教者人数对所有敌人造成伤害。",
    "zh-TW": "根據你的反教者人數對所有敵人造成傷害。"
  },
  "descriptionPlain": {
    "ar": "يمكن إلحاق الضرر بجميع الأعداء وفقًا لعدد أتباعك المعارضين.",
    "de": "Füge allen Gegnern entsprechend der Anzahl deiner abtrünnigen Anhänger Schaden zu.",
    "en": "Damage all enemies based on how many Dissenting Followers you have.",
    "es": "Inflige daño a todos los enemigos en función del número de adeptos desertores que tengas.",
    "fr": "Infligez des dégâts à tous les ennemis selon votre nombre d'adeptes rebelles.",
    "fr-CA": "Infligez des dégâts à tous les ennemis selon votre nombre d'adeptes rebelles.",
    "it": "Infligge danni a tutti i nemici in base al numero dei membri dissidenti del Culto.",
    "ja": "教団に所属している離反中の信者の人数に応じたダメージを敵全体に与える",
    "ko": "보유한 반목 중인 추종자들의 수에 비례해 모든 적에게 피해를 줍니다.",
    "nl": "Breng schade toe aan alle vijanden op basis van het aantal afvallige volgelingen dat je hebt.",
    "pt-BR": "Cause dano a todos os inimigos com base na sua quantidade de Seguidores Rebeldes.",
    "ru": "Вы наносите врагам урон, зависящий от количества инакомыслящих последователей.",
    "tr": "Sahip olduğun Başkaldıran Takipçi sayısına bağlı olarak tüm düşmanlara hasar verir.",
    "zh-CN": "根据你的反教者人数对所有敌人造成伤害。",
    "zh-TW": "根據你的反教者人數對所有敵人造成傷害。"
  },
  "dlc": false,
  "icon": "icons/relics/DealDamagePerFollower_Dammed.png",
  "id": "DealDamagePerFollower_Dammed",
  "interactionType": "Charging",
  "lore": {
    "ar": "من يجرؤون على التشكيك، سيُعاقبون.",
    "de": "Die Skeptiker werden aufgereiht.",
    "en": "Those who would question, be strung.",
    "es": "A quienes cuestionen, ensartadlos.",
    "fr": "Contestation est synonyme de pendaison.",
    "fr-CA": "Contestation est synonyme de pendaison.",
    "it": "Chi osa protestare, che venga mandato alla forca.",
    "ja": "我らが教団に疑問を持つ者よ、数珠繋ぎとなれ",
    "ko": "의문을 품는 자, 꿰이리라.",
    "nl": "Zij die vragen stellen, worden opgeknoopt.",
    "pt-BR": "Aqueles que questionam, sejam amarrados.",
    "ru": "Объединитесь, вопрошающие.",
    "tr": "Sorgulamaya cüret edenlerin sonu halattır.",
    "zh-CN": "质疑者啊，串连成线吧。",
    "zh-TW": "質疑者啊，串連成線吧。"
  },
  "majorDlc": false,
  "name": {
    "ar": "خرزات المعتزِل <color=#FD1D03>الملعونة</color>",
    "de": "<color=#FD1D03>Verdammte</color> Perlen des Einsiedlers",
    "en": "<color=#FD1D03>Damned</color> Beads of the Anchorite",
    "es": "Abalorios <color=#FD1D03>malditos</color> del ermitaño",
    "fr": "Perles de l'anachorète <color=#FD1D03>maudites</color>",
    "fr-CA": "Perles <color=#FD1D03>maudites</color> de l'anachorète",
    "it": "Rosario dell'anacoreta <color=#FD1D03>dannato</color>",
    "ja": "<color=#FD1D03>呪われた</color>隠者の数珠",
    "ko": "<color=#FD1D03>저주받은</color> 은자의 염주",
    "nl": "<color=#FD1D03>Verdoemde</color> kralen van de Anchoriet",
    "pt-BR": "Terço do Anacoreta <color=#FD1D03>Maldito</color>",
    "ru": "<color=#FD1D03>Проклятые</color> бусы аскета",
    "tr": "<color=#FD1D03>Lanetli</color> Münzevinin Tespihi",
    "zh-CN": "<color=#FD1D03>受诅咒的</color>隐修者念珠",
    "zh-TW": "<color=#FD1D03>受詛咒的</color>隱修者念珠"
  },
  "namePlain": {
    "ar": "خرزات المعتزِل الملعونة",
    "de": "Verdammte Perlen des Einsiedlers",
    "en": "Damned Beads of the Anchorite",
    "es": "Abalorios malditos del ermitaño",
    "fr": "Perles de l'anachorète maudites",
    "fr-CA": "Perles maudites de l'anachorète",
    "it": "Rosario dell'anacoreta dannato",
    "ja": "呪われた隠者の数珠",
    "ko": "저주받은 은자의 염주",
    "nl": "Verdoemde kralen van de Anchoriet",
    "pt-BR": "Terço do Anacoreta Maldito",
    "ru": "Проклятые бусы аскета",
    "tr": "Lanetli Münzevinin Tespihi",
    "zh-CN": "受诅咒的隐修者念珠",
    "zh-TW": "受詛咒的隱修者念珠"
  },
  "requiresCult": true,
  "subType": "Any",
  "thumb": "icons/relics/64/DealDamagePerFollower_Dammed.png",
  "unlockedBy": "Relics_Dammed_1",
  "weight": 1.0
}
