{
  "chargeCategory": "Slow",
  "chargeDamage": 110.0,
  "coop": false,
  "damageType": "DealsDamage",
  "description": {
    "ar": "عيون تسير في مدارات وتجمد الأعداء حالما تلمسهم.",
    "de": "Umkreisende Augen, die Gegner bei Kontakt einfrieren.",
    "en": "Orbiting eyes that freezes enemies on contact.",
    "es": "Ojos en órbita que congelan a los enemigos que tocan.",
    "fr": "Des yeux gravitent et gèlent les ennemis au contact.",
    "fr-CA": "Des yeux qui gravitent et gèlent les ennemis qu'ils touchent.",
    "it": "Occhi orbitanti che congelano i nemici al contatto.",
    "ja": "触れた敵を凍結させる眼を召喚する",
    "ko": "눈이 떠돌며 닿는 적을 얼립니다.",
    "nl": "Rondcirkelende ogen die vijanden bij aanraking bevriezen.",
    "pt-BR": "Olhos em órbita que congelam os inimigos ao fazer contato.",
    "ru": "Вы призываете глаза, которые вращаются вокруг вас и замораживают врагов при столкновении.",
    "tr": "Çevrende dönen ve bir düşmana dokunduğunda donduran gözler.",
    "zh-CN": "不断绕行的眼球，碰触到敌人时使其冻结。",
    "zh-TW": "不斷繞行的眼球，碰觸到敵人時使其凍結。"
  },
  "descriptionPlain": {
    "ar": "عيون تسير في مدارات وتجمد الأعداء حالما تلمسهم.",
    "de": "Umkreisende Augen, die Gegner bei Kontakt einfrieren.",
    "en": "Orbiting eyes that freezes enemies on contact.",
    "es": "Ojos en órbita que congelan a los enemigos que tocan.",
    "fr": "Des yeux gravitent et gèlent les ennemis au contact.",
    "fr-CA": "Des yeux qui gravitent et gèlent les ennemis qu'ils touchent.",
    "it": "Occhi orbitanti che congelano i nemici al contatto.",
    "ja": "触れた敵を凍結させる眼を召喚する",
    "ko": "눈이 떠돌며 닿는 적을 얼립니다.",
    "nl": "Rondcirkelende ogen die vijanden bij aanraking bevriezen.",
    "pt-BR": "Olhos em órbita que congelam os inimigos ao fazer contato.",
    "ru": "Вы призываете глаза, которые вращаются вокруг вас и замораживают врагов при столкновении.",
    "tr": "Çevrende dönen ve bir düşmana dokunduğunda donduran gözler.",
    "zh-CN": "不断绕行的眼球，碰触到敌人时使其冻结。",
    "zh-TW": "不斷繞行的眼球，碰觸到敵人時使其凍結。"
  },
  "dlc": false,
  "icon": "icons/relics/FreezeOnTouch_Familiar.png",
  "id": "FreezeOnTouch_Familiar",
  "interactionType": "Fragile",
  "lore": {
    "ar": "نظرة شاخصة جامدة.",
    "de": "Ein eisiges Starren.",
    "en": "An icy stare.",
    "es": "Una mirada helada.",
    "fr": "Un regard qui glace le sang.",
    "fr-CA": "Un regard qui glace le sang.",
    "it": "Uno sguardo glaciale.",
    "ja": "凍り付くような視線を感じる",
    "ko": "차가운 눈길이다.",
    "nl": "Een kille oogopslag.",
    "pt-BR": "Um olhar congelante.",
    "ru": "Холод во взгляде.",
    "tr": "Buz gibi soğuk bakışlar.",
    "zh-CN": "冷冰冰的怒瞪。",
    "zh-TW": "冷冰冰的怒瞪。"
  },
  "majorDlc": false,
  "name": {
    "ar": "عين آيسغور",
    "de": "Auge des Eisblutes",
    "en": "Eye of the Icegore",
    "es": "Ojo de ogrizo",
    "fr": "Œil de Glasang",
    "fr-CA": "Œil de Glasang",
    "it": "Occhio del Gelofuria",
    "ja": "アイスゴアの眼",
    "ko": "아이스고어의 눈",
    "nl": "Oog van de IJsgoor",
    "pt-BR": "Olho do Sangue Congelado",
    "ru": "Глаз Йетира",
    "tr": "Buzyaman'ın Gözü",
    "zh-CN": "冰牴之眼",
    "zh-TW": "冰牴之眼"
  },
  "namePlain": {
    "ar": "عين آيسغور",
    "de": "Auge des Eisblutes",
    "en": "Eye of the Icegore",
    "es": "Ojo de ogrizo",
    "fr": "Œil de Glasang",
    "fr-CA": "Œil de Glasang",
    "it": "Occhio del Gelofuria",
    "ja": "アイスゴアの眼",
    "ko": "아이스고어의 눈",
    "nl": "Oog van de IJsgoor",
    "pt-BR": "Olho do Sangue Congelado",
    "ru": "Глаз Йетира",
    "tr": "Buzyaman'ın Gözü",
    "zh-CN": "冰牴之眼",
    "zh-TW": "冰牴之眼"
  },
  "requiresCult": false,
  "subType": "Any",
  "thumb": "icons/relics/64/FreezeOnTouch_Familiar.png",
  "unlockedBy": "Relic_Pack1",
  "weight": 1.0
}
