{
  "chargeCategory": "Fast",
  "chargeDamage": 30.0,
  "coop": false,
  "damageType": "NoDamage",
  "description": {
    "ar": "يمكن تحويل القلوب الزرقاء إلى قلوب أرواح.",
    "de": "Verwandle blaue Herzen in Geisterherzen.",
    "en": "Convert Blue Hearts to Spirit Hearts.",
    "es": "Convierte los corazones azules en corazones fantasmas.",
    "fr": "Convertissez vos cœurs bleus en cœurs spirituels.",
    "fr-CA": "Convertissez vos cœurs bleus en cœurs spirituels.",
    "it": "Converte i cuori blu in cuori spirituali.",
    "ja": "ブルーハートをスピリットハートに変換する",
    "ko": "파란 심장을 영혼 심장으로 변화시킵니다.",
    "nl": "Zet blauwe harten om in spirituele harten.",
    "pt-BR": "Converte Corações Azuis em Corações Espirituais.",
    "ru": "Вы превращаете голубые сердца в эфемерные сердца.",
    "tr": "Mavi Kalpleri Ruh Kalplerine dönüştürür.",
    "zh-CN": "将蓝心化为灵心。",
    "zh-TW": "將藍心化為靈心。"
  },
  "descriptionPlain": {
    "ar": "يمكن تحويل القلوب الزرقاء إلى قلوب أرواح.",
    "de": "Verwandle blaue Herzen in Geisterherzen.",
    "en": "Convert Blue Hearts to Spirit Hearts.",
    "es": "Convierte los corazones azules en corazones fantasmas.",
    "fr": "Convertissez vos cœurs bleus en cœurs spirituels.",
    "fr-CA": "Convertissez vos cœurs bleus en cœurs spirituels.",
    "it": "Converte i cuori blu in cuori spirituali.",
    "ja": "ブルーハートをスピリットハートに変換する",
    "ko": "파란 심장을 영혼 심장으로 변화시킵니다.",
    "nl": "Zet blauwe harten om in spirituele harten.",
    "pt-BR": "Converte Corações Azuis em Corações Espirituais.",
    "ru": "Вы превращаете голубые сердца в эфемерные сердца.",
    "tr": "Mavi Kalpleri Ruh Kalplerine dönüştürür.",
    "zh-CN": "将蓝心化为灵心。",
    "zh-TW": "將藍心化為靈心。"
  },
  "dlc": false,
  "icon": "icons/relics/HeartConversion_Blessed.png",
  "id": "HeartConversion_Blessed",
  "interactionType": "Charging",
  "lore": {
    "ar": "ما الذي يدفع الأب دون عشيرة؟",
    "de": "Was treibt den Patriarchen ohne Clan an?",
    "en": "What drives the patriach without clan?",
    "es": "¿Qué guía al patriarca sin clan?",
    "fr": "Qu'est-ce qu'un patriarche sans son clan ?",
    "fr-CA": "Qu'est-ce qu'un patriarche sans son clan?",
    "it": "Cosa stimola un patriarca senza clan?",
    "ja": "部族なき族長を駆り立てるものとは何ぞ",
    "ko": "가족이 아니라면 무엇이 가장을 움직이게 하리요?",
    "nl": "Wat drijft de patriarch zonder clan?",
    "pt-BR": "O que motiva o patriarca sem um clã?",
    "ru": "Ради чего живёт вождь, лишившийся племени?",
    "tr": "Klanı olmayan bir reise yaşama isteği veren nedir?",
    "zh-CN": "没了族人的一族之长为何行动？",
    "zh-TW": "沒了族人的一族之長為何行動？"
  },
  "majorDlc": false,
  "name": {
    "ar": "الدموع <color=#03EAFD>المباركة</color> للأب الحاقد",
    "de": "<color=#03EAFD>Gesegnete</color> Tränen des rachsüchtigen Vaters",
    "en": "<color=#03EAFD>Blessed</color> Tears of the Vengeful Father",
    "es": "Lágrimas <color=#03EAFD>bendecidas</color> de la madre misericordiosa",
    "fr": "Larmes du père vengeur <color=#03EAFD>bénies</color>",
    "fr-CA": "Larmes <color=#03EAFD>bénies</color> du père vengeur",
    "it": "Lacrime del padre vendicativo",
    "ja": "<color=#03EAFD>祝福された</color>執念深き父の涙",
    "ko": "<color=#03EAFD>축복받은</color> 복수심에 불타는 아비의 눈물",
    "nl": "<color=#03EAFD>Gezegende</color> tranen van de wraakzuchtige vader",
    "pt-BR": "Lágrimas <color=#03EAFD>Abençoadas</color> do Pai Vingativo",
    "ru": "<color=#03EAFD>Священные</color> слёзы мстительного отца",
    "tr": "<color=#03EAFD>Kutsanmış</color> İntikamcı Babanın Gözyaşları",
    "zh-CN": "<color=#03EAFD>受祝福的</color>复仇父亲之泪",
    "zh-TW": "<color=#03EAFD>受祝福的</color>復仇父親之淚"
  },
  "namePlain": {
    "ar": "الدموع المباركة للأب الحاقد",
    "de": "Gesegnete Tränen des rachsüchtigen Vaters",
    "en": "Blessed Tears of the Vengeful Father",
    "es": "Lágrimas bendecidas de la madre misericordiosa",
    "fr": "Larmes du père vengeur bénies",
    "fr-CA": "Larmes bénies du père vengeur",
    "it": "Lacrime del padre vendicativo",
    "ja": "祝福された執念深き父の涙",
    "ko": "축복받은 복수심에 불타는 아비의 눈물",
    "nl": "Gezegende tranen van de wraakzuchtige vader",
    "pt-BR": "Lágrimas Abençoadas do Pai Vingativo",
    "ru": "Священные слёзы мстительного отца",
    "tr": "Kutsanmış İntikamcı Babanın Gözyaşları",
    "zh-CN": "受祝福的复仇父亲之泪",
    "zh-TW": "受祝福的復仇父親之淚"
  },
  "requiresCult": false,
  "subType": "Blessed",
  "thumb": "icons/relics/64/HeartConversion_Blessed.png",
  "unlockedBy": "Building_LightningRod",
  "weight": 1.0
}
