{
  "chargeCategory": "Fast",
  "chargeDamage": 40.0,
  "coop": false,
  "damageType": "NoDamage",
  "description": {
    "ar": "يمكن تدمير جميع بطاقات التارو النشطة. ستعطي كل بطاقة مدمَّرة نصف قلب فاسد.",
    "de": "Zerstöre alle aktiven Tarotkarten. Jede zerstörte Karte gewährt dir ein halbes krankes Herz.",
    "en": "Destroy all active Tarot Cards. Each destroyed card will give half a Diseased Heart.",
    "es": "Destruye todas las cartas del tarot activas. Cada carta destruida otorga medio corazón enfermo.",
    "fr": "Détruisez toutes vos cartes de tarot actives. Chaque carte détruite vous octroie la moitié d'un cœur corrompu.",
    "fr-CA": "Détruisez toutes vos cartes de tarot actives. Chaque carte détruite vous octroie la moitié d'un cœur corrompu.",
    "it": "Distrugge tutti i tarocchi attivi. Ogni carta infranta fornisce mezzo cuore afflitto.",
    "ja": "タロットカードすべてを破壊する。破壊したタロット1枚につき半分の病みし心臓を獲得する",
    "ko": "모든 활성 중인 타로 카드를 파괴합니다. 파괴된 카드 한 장 당 병든 심장 반쪽을 얻습니다.",
    "nl": "Vernietig alle actieve tarotkaarten. Elke vernietigde kaart geeft je een half ziekelijk hart.",
    "pt-BR": "Destrói todas as Cartas de Tarô ativas. Cada carta destruída dará meio coração doente.",
    "ru": "Вы уничтожаете все полученные карты Таро и получаете по половине больного сердца за каждую.",
    "tr": "Tüm etkin Tarot Kartlarını yok eder. Yok edilen her kart yarım Çürümüş Kalp kazandırır.",
    "zh-CN": "摧毁所有生效的塔罗牌，每摧毁一张牌就获得半颗病缠黑心。",
    "zh-TW": "摧毀所有生效的塔羅牌，每摧毀一張牌就獲得半顆病纏黑心。"
  },
  "descriptionPlain": {
    "ar": "يمكن تدمير جميع بطاقات التارو النشطة. ستعطي كل بطاقة مدمَّرة نصف قلب فاسد.",
    "de": "Zerstöre alle aktiven Tarotkarten. Jede zerstörte Karte gewährt dir ein halbes krankes Herz.",
    "en": "Destroy all active Tarot Cards. Each destroyed card will give half a Diseased Heart.",
    "es": "Destruye todas las cartas del tarot activas. Cada carta destruida otorga medio corazón enfermo.",
    "fr": "Détruisez toutes vos cartes de tarot actives. Chaque carte détruite vous octroie la moitié d'un cœur corrompu.",
    "fr-CA": "Détruisez toutes vos cartes de tarot actives. Chaque carte détruite vous octroie la moitié d'un cœur corrompu.",
    "it": "Distrugge tutti i tarocchi attivi. Ogni carta infranta fornisce mezzo cuore afflitto.",
    "ja": "タロットカードすべてを破壊する。破壊したタロット1枚につき半分の病みし心臓を獲得する",
    "ko": "모든 활성 중인 타로 카드를 파괴합니다. 파괴된 카드 한 장 당 병든 심장 반쪽을 얻습니다.",
    "nl": "Vernietig alle actieve tarotkaarten. Elke vernietigde kaart geeft je een half ziekelijk hart.",
    "pt-BR": "Destrói todas as Cartas de Tarô ativas. Cada carta destruída dará meio coração doente.",
    "ru": "Вы уничтожаете все полученные карты Таро и получаете по половине больного сердца за каждую.",
    "tr": "Tüm etkin Tarot Kartlarını yok eder. Yok edilen her kart yarım Çürümüş Kalp kazandırır.",
    "zh-CN": "摧毁所有生效的塔罗牌，每摧毁一张牌就获得半颗病缠黑心。",
    "zh-TW": "摧毀所有生效的塔羅牌，每摧毀一張牌就獲得半顆病纏黑心。"
  },
  "dlc": false,
  "icon": "icons/relics/DestroyTarotGainBuff_Dammed.png",
  "id": "DestroyTarotGainBuff_Dammed",
  "interactionType": "Fragile",
  "lore": {
    "ar": "يا جروح الماضي، أعينيني في الحاضر.",
    "de": "Qual der Vergangenheit, diene mir in der Gegenwart.",
    "en": "Agony of the past, serve me in present.",
    "es": "Agonía pasada, sírveme en el presente.",
    "fr": "Agonie du passé, aide-moi aujourd'hui.",
    "fr-CA": "Agonie du passé, aide-moi aujourd'hui.",
    "it": "Agonia del passato, servimi nel presente.",
    "ja": "過去の苦痛よ、今の我に力を",
    "ko": "과거의 고통은, 현재의 나를 섬긴다.",
    "nl": "Kwelling van het verleden, dien me in het heden.",
    "pt-BR": "Agonia do passado, sirva-me no presente.",
    "ru": "Муки прошлого, станьте подспорьем в настоящем.",
    "tr": "Geçmişin ızdırabı, bana şimdi lazımsın.",
    "zh-CN": "过去的煎熬啊，现在服侍我吧。",
    "zh-TW": "過去的煎熬啊，現在服侍我吧。"
  },
  "majorDlc": false,
  "name": {
    "ar": "مرآة كلاونيك <color=#FD1D03>الملعونة</color>",
    "de": "Claunecks <color=#FD1D03>verdammter</color> Spiegel",
    "en": "<color=#FD1D03>Damned</color> Clauneck's Mirror",
    "es": "Espejo <color=#FD1D03>maldito</color> de Clauneck",
    "fr": "Miroir de Clauneck <color=#FD1D03>maudit</color>",
    "fr-CA": "Miroir <color=#FD1D03>maudit</color> de Clauneck",
    "it": "Specchio di Clauneck <color=#FD1D03>dannato</color>",
    "ja": "<color=#FD1D03>呪われた</color>クラウネックの鏡",
    "ko": "<color=#FD1D03>저주받은</color> 클라우넥의 거울",
    "nl": "<color=#FD1D03>Verdoemde</color> Claunecks spiegel",
    "pt-BR": "Espelho de Clauneck <color=#FD1D03>Maldito</color>",
    "ru": "<color=#FD1D03>Проклятое</color> зеркало Клонека",
    "tr": "<color=#FD1D03>Lanetli</color> Clauneck'in Aynası",
    "zh-CN": "<color=#FD1D03>受诅咒的</color>克劳内克之镜",
    "zh-TW": "<color=#FD1D03>受詛咒的</color>克勞涅克之鏡"
  },
  "namePlain": {
    "ar": "مرآة كلاونيك الملعونة",
    "de": "Claunecks verdammter Spiegel",
    "en": "Damned Clauneck's Mirror",
    "es": "Espejo maldito de Clauneck",
    "fr": "Miroir de Clauneck maudit",
    "fr-CA": "Miroir maudit de Clauneck",
    "it": "Specchio di Clauneck dannato",
    "ja": "呪われたクラウネックの鏡",
    "ko": "저주받은 클라우넥의 거울",
    "nl": "Verdoemde Claunecks spiegel",
    "pt-BR": "Espelho de Clauneck Maldito",
    "ru": "Проклятое зеркало Клонека",
    "tr": "Lanetli Clauneck'in Aynası",
    "zh-CN": "受诅咒的克劳内克之镜",
    "zh-TW": "受詛咒的克勞涅克之鏡"
  },
  "requiresCult": false,
  "subType": "Any",
  "thumb": "icons/relics/64/DestroyTarotGainBuff_Dammed.png",
  "unlockedBy": "Relics_Dammed_1",
  "weight": 1.0
}
